pin,Numărul întrebării,Textul întrebării,Răspuns,Criteriu de acceptare,Comentariu,Surse,Autor,Indentificatorul etapei,Echipa autorului întrebării
11/4/2014 23:30:41,2,"Adăpostit între dealurile împădurite ale munţilor Ardeni, acest oraş Belgian este cunoscut pentru izvoarele sale minerale, folosite încă din secolul XVI pentru calităţile lor curative.

Numiţi, scurt, acest oraş belgian.",Spa,,,,Ion Vasilică,C_P_2014_24_2_D,LAREME
11/5/2014 11:04:56,3,"Ashabad, Belgrad, Ierusalim, Lisabona, Lvov, Milano, Minsk, Odessa, Paris, Praga, Riga, Sofia, Tallin, Taskent, Torino, Zagreb. Paradoxal, toate acestea sunt nu departe. 

Daca va dati seama unde, răspundeți peste un minut ce cuvânt a fost omis de mai multe ori în întrebare.",Strada,,Acestea sunt străzi din Chișinău.,,Kira Semionov,C_P_2014_24_2_D,Bifidoc
11/5/2014 11:05:31,4,Acest personaj creat de Elzie Crisler Segar consumă un anumit produs de-i sar ochii. Numiți personajul.,Popeye,,,,Ion Vasilică,C_P_2014_24_2_D,LAREME
11/5/2014 11:06:06,5,Această companie de game development fondată în 1980 și-a ales numele cu ideea de a fi cu un pas înaintea celor de la IBM. Numiți compania.,HAL,,,http://en.m.wikipedia.org/wiki/HAL_Laboratory,,C_P_2014_24_2_D,A-Team
11/5/2014 11:06:44,6,"În 1983, Marvel Comics au publicat o ediție întitulată “Spider-Ham”, având ca erou central pe Spider Pig. 

Numiți cât mai exact alter-ego-ul personajului principal.",Peter Porker,,,,,C_P_2014_24_2_D,A-Team
11/5/2014 11:07:42,7,"Sper că întrebarea să vă trezească zâmbetul. În engleză, acest procedeu este numit Threading. Thread se traduce ca “Fir”. Se crede că acest procedeu a aparut în India 6000 de ani în urmă și s-a răspîndit în Asia, Orientul Mijlociu și, mai recent, în Europa.

Cum o cheamă pe pariziana celebră care arată de parcă ar fi fost supusă acestui procedeu?",Mona Lisa,,Threading - epilarea sprîncenelor. Sprâncenele Monei Lisa sunt abia vizibile,"http://en.wikipedia.org/wiki/Threading_(epilation)
",,C_P_2014_24_2_D,A-Team
11/5/2014 11:08:25,8,"Se spune că denumirea acestei mărci de automobile americane provine de la o abreviere pentru vehicule cu scop general, folosite în armată. Dar care este aceasta marcă de automobile?
",Jeep,,"Automobilul era numit de soldați General Purpose Vehicle, abreviat ca GP, de aici și denumirea Jeep.",http://en.wikipedia.org/wiki/Jeep,Horia Burca,C_P_2014_24_2_D,Eliadorii
11/5/2014 11:09:06,9,"Atentie, in întrebare sunt înlocuiri:

Înainte, atunci cînd ""Mickey"" încă era “membru cu drepturi depline” în EL, un mod ușor de a memora principalele elemente ale LUI era fraza ""My Very Educated Mother Just Serve dUs Nine Pizzas"". 

Peste un minut raspundeti prin doua cuvinte ce se incep cu aceeasi litera, ce este EL?
",Sistemul solar,,,,Kira Semionov,C_P_2014_24_2_D,Bifidoc
11/5/2014 11:10:20,10,"Pe site-ul dexonline.ro, un articol despre cuvântul a estropia, definit ca “a schilodi, a mutila“, este însoțit de o imagine sugestivă, care reflectă un conflict recent. Imaginea este compusă din doua elemente, dintre care unul este un foarfece.
Dacă v-ați dat seama despre ce este vorba în imagine, scrieți peste un minut care sunt culorile foarfecelui.","alb, albastru, roșu",,Imaginea se referă la anexarea Crimeei de către Rusia.,"http://dexonline.ro/cuvantul-lunii
",Horia Burca,C_P_2014_24_2_D,Eliadorii
11/5/2014 11:11:08,11,O glumă despre programatori spune că ei mereu încurcă 2 sărbători internaționale. Numiți sărbătorile.,Halloween și Crăciunul,,oct 31 = dec 25; numărul 31 în sistemul octal este egal cu numărul 21 în sistemul decimal.,,Victor Oprea,C_P_2014_24_2_D,Eliadorii
11/5/2014 11:14:15,12,"După una din versiuni, această expresie provine de la faptul că cei care veneau sa se plângă de impozite prea mari erau ucişi. Numiţi expresia în rusa sau româna, dacă ea este denumirea unui film sovietic din 1979.",Moscova nu crede lacrimilor,Moskva slezam ne verit,,,Victor Clima,C_P_2014_24_2_D,Eliadorii
11/5/2014 11:14:51,13,"O versiune a şahului constă în înlocuirea fiecărei figuri cu o doza de băutură alcoolică: cu cât mai importantă este figura, cu atât mai mare şi mai concentrată este doza.

Numiţi cât mai exact cum poate un simplu jucător câştiga de la un Grossmeister?",Jertfeşte regina,,,,Victor Oprea,C_P_2014_24_2_D,Eliadorii
11/5/2014 11:16:08,14,"Acest ansamblu de piese a fost lansat la 5 iulie 1946, de către Louis Reard, la doar patru zile după startul unor testelor nucleare lângă atolul cu același nume. Impactul lui asupra moralităţii acelor vremuri e comparat cu efectul bombei atomice.

Cum se numește el?",Bikini,,,http://ro.wikipedia.org/wiki/Bikini,Cristi Reghiment,C_P_2014_24_2_D,Eliadorii
11/5/2014 11:16:41,15,"Potrivit unui banc, chinezii au reușit să spargă site-ul Pentagonului. Cum au reușit acest lucru?",Au încercat fiecare câte o parolă.,,,,Iulian Bruma,C_P_2014_24_2_D,Eliadorii
11/5/2014 11:17:23,17,"În evul mediu, medicul Andreas Vesalius a fost persecutat de Biserică deoarece afirma că toți oamenii au același număr de ALFE. Într-un banc, Eva numără ALFELE soțului pentru a se asigura că nu este înșelată. 

Ce am înlocuit prin ALFE?",coaste,,,http://www.hrono.info/biograf/bio_we/vezaliy.html,,C_P_2014_24_2_D,A-Team
11/5/2014 11:19:30,18,"Întrebare cu înlocuiri.

Primul automobil care avea paturi incorporate a fost construit în 1838, în Marea Britanie. Multe personalități aveau automobile proprii, de regulă familiile regale din secolul 19-20. În anul 1940, Hitler a prezentat un ultimatum fix in același automobil unde a fost semnată capitularea Germaniei in I Război Mondial. Astăzi putem observa șiruri de automobile chiar și în Chișinău, în apropierea Circului.

Ce cuvânt a fost înlocuit prin “automobil”?",Vagon,,,http://en.wikipedia.org/wiki/Second_Armistice_at_Compi%C3%A8gne,Cristian Kulcitki,C_P_2014_24_2_D,Eliadorii
11/5/2014 11:21:05,16,"Atenție, lista:

  26 august 1978 – al 263-lea x cu nume de primul
  16 octombrie 1978 – al 264-lea x cu nume de al doilea
  2005 – al 265-lea x cu nume de al 16-lea
  2013 – al 266-lea x 

Nu vă cerem sa scrieți ce am înlocuit prin x, dar spuneți-ne: Ce premieră a marcat trecerea de la 265-lea x la cel de-al 266-lea?",Demisia de bună voie (fără presiune externă) a unui papă,,"Benedict al 16-lea și-a dat demisia de buna voie, în premieră pentru un papă, fiind succedat de Papa Francisc. Precedenții acestor pontifi sunt Papa Ioan Paul I, Papa Ioan Paul II.","http://en.wikipedia.org/wiki/List_of_popes
",Cristian Kulcitki,C_P_2014_24_2_D,Eliadorii
11/5/2014 11:26:27,20,"Întrebare cu înlocuiri.

Germania – 107 metri
Franța – 93 metri
Ucraina – 35 metri
România – 32 metri
Moldova – 3 metri 

Dacă v-ați dat seama ce am înlocuit prin Metri, peste un minut spuneți-ne câți Metri sunt în Chișinău.",2,,Este vorba de rețeaua de magazine Cash and Carry Metro și numărul de filiale în diferite țări. În Moldova avem 3: 2 în Chișinău și 1 în Bălți.,,Horia Burca,C_P_2014_24_2_D,Eliadorii
11/5/2014 11:29:03,21,"Formaţia the Flaming Lips a dorit să înregistreze un album împreună cu o orchestră simfonică, însă lipsa de timp și bani le-a lăsat doar opțiunea de a intregistra sunetele orchestrei cu o clapă MIDI. Pentru ca aceasta să sune mai puțin sintetic, ei au facut un anumit lucru.

Care anume, dacă la începutul multor concerte simfonice, acțiunea trupei ar parea relative irațională?",Au dezacordat clapele Midi.,,"De fapt, unele instrumente din orchestra se dezacordează pe parcursul concertului, creând în așa fel sunetul autentic al unei orchestre.",,Mircea Baștovoi,C_P_2014_24_2_D,Bifidoc
11/5/2014 11:30:03,22,"Vestitul corsar englez Francis Drake e bine-cunoscut pentru raidurile asupra coloniilor spaniole din America Latină. Există o groază de documente istorice care demonstrează cantitatea imensă de aur prădată din coloniile spaniole. Însă curios este că de fapt multe cifre din documentele oficiale au fost exagerate.

Dar din ce motiv?",Corupția,Se acceptă după sens,Funcționarii spanioli în așa fel furau bani din budgetul Spaniei.,,,C_P_2014_24_2_D,Bifidoc
11/5/2014 11:31:09,23,"Există o ipoteză potrivit căreia acest element din portul unor pirați nu se datora unui handicap fizic, ci era folosit dintr-un motiv practic.

Dacă vă dați seamă despre ce element vorbim, peste un minut ne veți spune în ce fel anume acesta le sporea piraților un anumit simț.",Îi ajuta să vadă mai bine în întuneric.,,"Este vorba despre bandajul pe ochi, pe care potrivit unei, ipoteze o parte din pirați îl purtau din motive practice.",,,C_P_2014_24_2_D,Bifidoc
11/5/2014 11:32:11,24,"Această metodă folosea o scândură de lemn, de obicei în formă de pană, cu o greutate la un capăt, pentru ca ea să plutească perpendicular apei. De scândura era legată o frânghie lungă și subțire, care avea ""X""-uri la 
intervale uniform distribuite.

Aceasta este o descriere a apariției lui ""X"" ca unitate de măsură. Ce este ""X""?",Nod,,"Este vorba de nodul maritim, unitate de măsură a vitezei pe apa sau în aer. Scindura aflindu-se in apa, trage fringhia de pe nava, in timp ce un marinar numara nodurile trase intr-un interval de timp. Aceasta a dus la standartizarea unitatii de masura a vitezei in noduri si mile nautice.
",http://gizmodo.com/why-the-speed-of-ships-is-measured-in-knots-1543670396,,C_P_2014_24_2_D,Bifidoc
11/5/2014 11:33:18,25,"Din cauza secetei curente din California, râul Sacramento a devenit prea mic și cald pentru a permite migrația anuală a somonilor. Astfel, oficialii statului au decis să faca un anumit lucru.

Daca vă dați seama ce anume, peste un minut veți scrie pe foile de răspuns o frază celebră de natură condițională, menționată pentru prima dată în lucrările lui Francis Bacon.","Dacă muntele nu vine la Mahomed, Mahomed se va duce la munte.",,Oficialii statului California au decis sa transporte somonul tânăr până la coasta oceanului în camioane.,http://gizmodo.com/california-salmon-will-get-a-free-ride-to-the-ocean-in-1542954666,,C_P_2014_24_2_D,Bifidoc
11/5/2014 11:34:36,26,"Atentie, listă:

imagini arhitecturale
o strofă
o semnatură
un an
numere
simboluri

Spuneţi: cine sau ce lipseşte din această listă?",Ștefan cel Mare, portretul lui Ștefan Cel Mare,Acestea sunt elementele prezente pe leul moldovenesc.,,,C_P_2014_24_2_D,
11/5/2014 11:36:35,27,"Cel mai cunoscut titlu al orășelului Churchill de pe coasta de Vest a Golfului Hudson din Manitoba, Canada, este ”Capitala mondială a LOR”. Nu degeaba locuitorii acestui orășel își lasă mașinile deschise, în caz de întâlniri-supriză cu EI.

Numiți-i pe EI.",Urșii polari,,,"http://en.wikipedia.org/wiki/Churchill,_Manitoba",,C_P_2014_24_2_D,
11/5/2014 11:37:59,28,"În unul din episoadele serialului Big Bang Theory, 3 prieteni îl discuta pe al patrulea, Sheldon, care este cel mai deştept, dar si cel mai egoist dintre ei. Într-un incident, Sheldon a încasat un pumn pentru comportamentul său.

Atenţie, dialog cu înlocuiri:
 -I-ai povestit surorii tale cum Portarul l-a bătut pe Sheldon? 
 -Nu, dar îi zic acum: Portarul ţinea un discurs la universitatea noastră, iar Sheldon s-a apropiat de el la sfârșit și i-a zis, daca atrăgea mai puțină atenție copiilor bolnavi din Africa, puteai sa te uiți mai mult în 
ferestrele vieții.

Ce s-a înlocuit prin Portarul?",Bill Gates,,Ferestrele vieții – Windows Vista,http://bigbangtheory.wikia.com/wiki/The_Toast_Derivation,Dima Colesnicov,C_P_2014_24_2_D,Bifidoc
11/5/2014 11:51:36,29,"Acesta este cel mai lung cuvânt in limba engleza care are literele într-o ordine alfabetică. Fără a aproxima, vă rugăm să scrieți exact acest cuvânt din 6 litere.",almost,,,"http://en.wikipedia.org/wiki/Longest_word_in_English
",,C_P_2014_24_2_D,A-Team
11/5/2014 11:52:24,30,Numiți filmul posterul căruia înfățișează un toc de pantof în formă de trident.,The Devil Wears Prada,,,http://en.wikipedia.org/wiki/The_Devil_Wears_Prada_(film),,C_P_2014_24_2_D,A-Team
11/5/2014 12:07:33,31,"Pentru a se convinge de acustica bună a teatrului din Micene, spectatorilor li se propunea SĂ FACA ACEASTA. De obicei, oamenii fac aceasta în preajma bazinelor de apă sau a havuzurilor.

Ce a fost înlocuit prin A FACE ACEASTA ?",A arunca monede,,,”Золотойглобус. Выпуск 4. Греция”,,C_P_2014_24_2_D,A-Team
11/5/2014 12:11:07,33,"Fiți pe undă! Se știe că popularitatea ACESTUIA se datorează unei gafe în direct: ”In lumea capitalistă omul exploatează pe om, în lumea socialistă e invers”

Numiți-l prin 2 cuvinte.",Radio Erevan,Armyanksoe radio,,http://tinyurl.com/2dn5722,,C_P_2014_24_2_D,
11/5/2014 12:14:34,33,Unul dintre cântecele de protest ale formației sovietice Ivasi critica maleabilitatea și uniformitatea populației URSS. Peste un minut răspundeți vă rog despre care substanță este cântecul în cauză.,aluat,,protest - про тесто.,http://www.youtube.com/watch?v=XjBjsaQws58,Dima Colesnicov,C_P_2014_24_2_D,Bifidoc
11/5/2014 12:20:50,34,"Fiind situat în Turcia, acesta are două vîrfuri cunoscute sub denumirea de ”X-ul Mare” și “X-ul Mic”. X-ul totodată este reprezentat pe stema Armeniei, fiind simbolul național armean. Se mai știe că X a servit drept loc de supraviețuire în timpul unui eveniment menționat în Biblie.

Ce am înlocuit prin X?",Ararat,,"Este vorba de muntele Ararat, iar evenimentul mentionat in Biblie este potopul. Pe acest munte a ajuns arca lui Noe.","http://ro.wikipedia.org/wiki/Ararat
",Iulian Bruma,C_P_2014_24_2_D,Eliadorii
11/5/2014 12:22:15,35,"El este de două tipuri: purtat în zile obișnuite și de ceremonie. Cel pentru bărbați este de obicei mai sever, din mătase neagră. El a intrat în moda europeană, la fel ca și un accesoriu care se asorta cu acesta. Echivalentul din India nu a ajuns până în Europa, din cauză că e mai greu de obținut fără vreo cusătură sau ac.

Ce este el?",Kimono,,"E vorba de kimono și sari, dar sari, deoarece a mai greu de confecționat, nu a devenit la fel de populară.","http://ro.wikipedia.org/wiki/Kimono
Curiozități de ieri și de azi, p.197",Cristi Reghiment,C_P_2014_24_2_D,Eliadorii
11/5/2014 12:22:58,36,"Acest om de stiinta a aparut in unul din episoadele Star Trek: The New Generation. Pe setul de filmare vazând Warp-Core-Drive-ul (Mecanism ce permite deplasarea la viteze mai mari decat viteza luminii) el a remarcat ca lucreaza asupra acestuia.

Cine e savantul?",Stephen Hawking,,,http://en.wikipedia.org/wiki/Warp_drive_(Star_Trek),,C_P_2014_24_2_D,
11/5/2014 12:24:36,37,"Atentie, citat dintr-un articol:

""O situatie de vreme intr-adevar neobisnuita, conform Serviciului National de stare a vremei: Trei zone masive cu presiune joasa s-au format asupra intregului continent Nord American. NASA Goddard le descrie ca trei X-și atmosferici.""

Intr-adevar semanind cu X-și vizual, te-ai gindi ca aceasta este o actiune publicitara a premierei mult asteptata de multi de pe data de 6.4.2014. Numiti X.",Dragon,,Este vorba de premiera noului sezon de Game of Thrones.,http://sploid.gizmodo.com/the-three-dragon-storms-sweeping-the-united-states-as-s-1555787976/@jesusdiaz,,C_P_2014_24_2_D,
11/5/2014 12:26:27,38,"Într-un interview cu un scenarist al unui serial, reporterul remarcă că în secolul 24 oamenii ar fi lecuit chelirea la bărbați. La care scenaristul a răspuns că în secolul 24 oamenilor nu le-ar păsa.

Numiți cu exactitate serialul TV al cărui scenarist era intervievat.",Star Trek TNG,,,"http://projects.latimes.com/hollywood/star-walk/patrick-stewart/
",,C_P_2014_24_2_D,
11/5/2014 12:29:26,39,"Dupa o intâmplare recentă, pe internet au aparut niște campanii publicitare trucate cum ar fi  ”Oriunde te-ai duce, nimeni nu va ști.” Peste un minut scrieți care este întâmplarea sau care este obiectul publicității.",Disparitia avionului de pe cursa MH307,Se acceptă și răspunsurile care menționează Boeing 777 sau cursa Malaysian Airlines în locul zborului MH307,,http://urbanlegends.about.com/b/2014/03/16/malaysia-airlines-lose-yourself-ad-is-fake.htm,Horia Burca,C_P_2014_24_2_D,Eliadorii
11/5/2014 12:32:55,R1,"CITAT DESCHIS
""Ultima întrebare a fost formulată pentru întâia oară [...] într-un moment când omenirea pășea spre lumină.""
CITAT ÎNCHIS

Fără date suficiente, computerul Multivac nu a putut da un răspuns. Abia după ce entropia universului a atins valoare maximă și urmașul său, AC, a înglobat toate datele ce puteau fi colectate, acesta a aflat cum să inverseze direcția entropiei. Dar nu mai exista nici om care să asculte răspunsul. Și atunci AC a pronunțat 3 cuvinte. Și așa a fost.

Întrebare: care au fost cele 3 cuvinte? (în română)",Să fie lumină!,,"Sfârșitul povestirii ""Ultima întrebare"" de Isaac Asimov coincide cu cuvintele spuse de Dumnezeu în cartea Genezei.","http://gawrylyta.files.wordpress.com/2011/11/isaac_20asimov_20-_20ultima_20intrebare.pdf
Geneza: http://www.bibliaortodoxa.ro/vechiul-testament/25/Facerea",,C_P_2014_24_2_D,
11/5/2014 12:34:34,R2,"În sec VII-lea î.Hr., în Grecia, a fost scris un cod de legi, care au fost valabile mai multe secole și erau foarte aspre deoarecece prevedeau chiar și pentru delicte neînsemnate pedeapsa cu moartea, despre ele zicându-se că au fost scrise cu sânge, ci nu cu cerneală.

De la numele autorului acestui cod de legi (sec. al VII-lea î.Hr.), provine un adjectiv care nu are nimic comun cu substantivul cu același radical. Numiți adjectivul.",Draconic,,,http://en.wikipedia.org/wiki/Draco(lawgiver),Cristi Reghiment,C_P_2014_24_2_D,Eliadorii
11/4/2014 20:34:17,1,"În categoria ""Vezi şi..."" a unui articol din wikipedia întitulat BETA, se regăsesc următoarele titluri:

  Hipergamie
  Liderism
  Teritoriu
  Ordinea ciugulitului

Ce cuvânt a fost înlocuit prin BETA?",Alfa,,"Articolul este despre comportamentul social al animalelor ALFA, adică a animalelor cu trăsături dominante în grup.
","http://en.wikipedia.org/wiki/Alpha_(ethology)
",Andrei Lutenco,C_P_2014_24_3_SL,LAREME
11/4/2014 20:37:00,2,"În 1814, patru frați meseriași au dat piept cu soldații ruși în încercarea de a-și proteja proprietatea, cu care-și câștigau pâinea, amplasată în unul din faimoasele cartiere ale Parisului. Toți patru au murit, unul fiind executat prin sfârtecare. Nu că le-ar face multă cinste fraților, dar 75 de ani mai târziu în acest cartier a apărut... Ce? Numiți-o prin două cuvinte.",Moulin Rouge,,,,Ion Vasilică,C_P_2014_24_3_SL,LAREME
11/4/2014 20:50:48,3,"Domnul Șabad învățase împreună cu Cehov la Universitatea din Moscova, purta monoclu și bărbuță de țap; avea reputația unui om extrem de bun la inimă, oferindu-și gratis serviciile celor săraci. După o întâmplare care a implicat 3 copii și o pisică, un oaspete celebru al domnului Șabad a fost inspirat să-l creeze pe el.

Pe cine?",Doctorul Aibolit,Doctorul Aoleu sau Vai-mă-doare,"Șabad, ca și Cehov, era medic. Trei copii i-au adus doctorului o pisică, pe care el a lecuit-o. Kornei Ciukovski l-a creat pe doctoral Aibolit după modelul cunoscutului său.","Revista “Vokrug Sveta”, apr. 2012",Ion Vasilică,C_P_2014_24_3_SL,LAREME
11/4/2014 20:52:09,4,"Creatorul EI, în copilărie era deranjat de conflictele dintre diversele grupări etnice din oraşul său natal. O şcoala britanică care o are pe EA ca obiect de studiu îi prezintă valoarea astfel: ""Înainte, multe şcoli învăţau elevii să cânte la flaut, nu pentru a produce o naţiune de interpreţi de flaut, ci pentru a-i pregăti pentru studiul altor instrumente muzicale"".

Numiţi-o printr-un singur cuvânt.",Esperanto,,Obiectul de studiu limba Esperanto era apreciat ca și o metodă de a facilita studiul altor limbi.,"http://en.wikipedia.org/Esperanto
",Andrei Lutenco,C_P_2014_24_3_SL,LAREME
11/4/2014 20:53:54,5,"O trăsătură unică pentru forțele armate ale Marii Britanii este că toate tancurile din dotarea ei dispun de un dispozitiv mai puțin folositor pe câmpul de lupta, care este însă pe larg utilizat de soldați. Dar la ce este folosit acest dispozitiv, daca fiecare din noi avem ceva asemanator in casele noastre?",fierbe apa pentru ceai,,,http://en.wikipedia.org/wiki/Challenger_2#Crew_and_accommodation,Horia Burca,C_P_2014_24_3_SL,Eliadorii
11/4/2014 20:56:05,6,"În anul 471 î.e.n, în pofida unor importante succese militare şi politice, generalul atenian Temistocle pleacă în oraşul Argos. În wikipedia, această informaţie este însoţită de imaginea unui con cu numele lui Temistocle pe el.

În unul din cuvintele din întrebare am omis 5 litere. Reproduceţi cuvântul iniţial.",ostra,,"Temistocle a fost ostracizat, o procedură pur democratică care nu presupune vreo vină din partea celui supus ei. Ci doar voința poporului. Cuvântul ostracizare provine de la ostracon, un ciob de lut ars pe care 
se scria numele celui supus procedurii.","http://en.wikipedia.org/Themistocles
","Sandu Cojocari, Andrei Lutenco",C_P_2014_24_3_SL,LAREME
11/4/2014 21:08:04,8,"În prima decadă a lunii trecute, o prietenă a autorului întrebării a transmis din Kiev salutări priEtEnelor, pozând lângă un X improvizat din Y-uri, redând atmosfera Maidanului. Dacă face un singur pit-stop, șoferul de formula 1, de regula folosește XYuri pe durata cursei.

Ce am înlocuit prin X și Yuri?","X - 8; Yuri - cauciucuri, pneuri, anvelope",,,,Andrei Lutenco,C_P_2014_24_3_SL,LAREME
11/4/2014 21:10:27,9,"Conform unei versiuni mai puțin tolerate de istorici, lucrătorii căilor ferate purtau cu ei X când vizitau anumite încăperi, pentru ca să fie ușor găsiți de membrii echipajului în cazuri urgente. Numiți X cu două cuvinte.",Felinare roșii, lanterne roșii și după sens,"Lucrătorii căilor ferate frecventau casele de toleranță. Se presupune că de la aceastpă practică au apărut cartierele felinarelor roșii. De asemenea, după tradiție, ultimul vagon dintr- garnitură poartă o lanternă roșie.",,,C_P_2014_24_3_SL,LAREME
11/4/2014 21:11:55,10,"Deși, de regulă, legătura dintre ELE este fixă, ELE pot lua curbele datorită formei care tinde spre una conică. Într-un cântec popular cu itinerar, se utilizează forma neobișnuită a pluralului pentru ELE.
Numiți-le prin trei cuvinte.",Roțile de tren,,"“Trenule, mașină mică, unde-l duci pe Ionică... Din Craiova la Pitești, Și-l dai jos la București... Trenule, să nu ai parte... de șuruburile toate și de șina de sub roate...” osia cărora este fixă, ceea ce implică lipsă de 
diferențial. În curbe, roata din stânga se rotește cu o viteză diferită de cea din dreapta, iar pentru a compensa lipsa asta de diferențial, roțile de tren sunt de obicei conice. În interiorul curbei, roata se mișcă pe șină pe circumferința mai mică, și invers.",,Ion Vasilică,C_P_2014_24_3_SL,LAREME
11/4/2014 21:12:42,11,"Rastafarienii îl consideră pe EL drept unul dintre primii rastafarieni. Într-un film documenar al lui Avi Mograbi, moartea LUI este povestită în paralel cu știrile despre teroriștii sinucigași. Numiți-l.",Samson,,,În întrebare.,Andrei Lutenco,C_P_2014_24_3_SL,LAREME
11/4/2014 21:13:38,12,"Într-o povestire a lui Terry Pratchet, un reprezentant al acestei specii, aflându-se într-o anumită situație, nu este de acord cu starea lucrurilor și se teleportează. Urmașii acestuia au moștenit gena teleportării și au format o rasă.

Cu ce nume propriu e numită această rasă?",Schroedinger,,E vorba despre pisica din experimental lui Schroedinger.,În întrebare.,Andrei Lutenco,C_P_2014_24_3_SL,LAREME
11/4/2014 21:14:49,13,"Dintre cele trei, Fetița era preferata LUI. Cea Pictată era cea mai sprintenă. Ce-a de-a treia era cea mai mare  şi, respectiv, avea rolul care corespunde titlului pe care l-a primit EL mulțumită celor trei.

Numiți rolul celei de-a treia, prin două cuvinte.",Navă/vas amiral,,"Este vorba despre navele Nina, Pinta și Santa Maria. Descoperirea făcută cu ajutorul acestui trio, cu Santa Maria în rol de navă amiral, i-au adus lui Columb titlul de Amiral al Oceanului.","Wikipedia: articolele despre Pinta, Nina, Santa Maria și Cristofor Columb.",Ion Vasilică,C_P_2014_24_3_SL,LAREME
11/4/2014 21:16:51,14,"Text distribuit:

Întunecată-i zarea de perdele
de nori, de tunet și furtună multă,
dar după ce acestea tac, ascultă:
ciripituri se-aud, ca-n ritornele.

Adie blând zefirul, da-l gonește
din nord un vânt amar cum e pelinul
și plânge păstorașul când privește
aversa furioasă ca destinul.

Jocul și cântul mai plăcut le este
pe-o melodie temperată, pură;
e vremea ce pe mulți îi moleșește
și cel mai dulce somn îl află-n șură.

Să te ridici și să fugi iar pe gheață
până de tot se strică și dispare,
s-asculți cum vântul de la nord din față
în ușă bate, cu-altele-n suflare.

Aveți în față patru fragmente ale unui set de sonete scrise în 1725 al căror autor este doar presupus. 
Încercați totuși peste un minut să numiți cel mai probabil autor al acestor sonete, dar și să reproduceți numele cunoscut dat acestui grup de sonete.","Antonio Vivaldi, Anotimpurile sau Cele patru anotimpuri.",,Se presupune că aceste sonete aparțin peniței autorului perlelor muzicii clasice “Cele 4 anotimpuri”.,"http://vasile-andreica.blogspot.com/2014/03/sonetele-scrise-de-antonio-vivaldi.html
",Ion Dodi,C_P_2014_24_3_SL,LAREME
