pin,Numărul întrebării,Textul întrebării,Răspuns,Criteriu de acceptare,Comentariu,Surse,Autor,Indentificatorul etapei,Echipa autorului întrebării
11/6/2014 11:51:29,3,"Romanul lui Alexandre Dumas ”Cei trei mușchetari”, era publicat pe capitole în ziarul ”Le Siècle”, în perioada martie-iulie 1844. În această perioadă, contractul autorului cu ziarul prevedea o anumită particularitate în achitarea banilor, o particularitate de care a profitat mult și un poet sovietic ce a activat la începutul secolului XX. Anume datorită acesteia, Dumas a hotărît să introducă în textul romanului un anumit personaj. Care anume?",Grimaud,Slujitorul lui Athos,"Dumas era plătit pentru numărul de rînduri scrise (la fel ca și poeții sovietici la începutul secolului XX). Dumas a hotărît atunci să introducă în roman un personaj care să răspundă doar prin ”Da” sau ”Nu”, și aceste replici erau achitate ca un rînd întreg. Maiacovski își scria poeziile sub forma renumitei scărițe, fapt care îi permitea să obțină mai mulți bani.",http://yablor.ru/blogs/kogda-mayakovskiy-stal-pisat-stihi-lesenkoy-drugie/806852,Sergiu Iacob,SV_2014,SER
11/6/2014 11:54:09,4,"După prelungirea unei străzi din Londra în anii 30 ai sec. XX, compania “Abby National”, ce avea sediul  în una din cladirile nou-construite a fost nevoită să angajeze un secretar ce se ocupa de prelucrarea corespondenţei ce nu era adresată companiei. Numiţi strada pe care era amplasată clădirea.",Baker Street,,"Baker Street 221 era o adresa ficţională, atribuită lui Sherlock Holmes. După prelungirea străzii adresa a devenit reală.",https://en.wikipedia.org/wiki/221B_Baker_Street,Maxim Cumpanici,SV_2014,SER
11/6/2014 11:55:12,5,"Blitz dublu:
Epigramă de Corneliu Berbente:
Am zis: „OMEGA au cu carul"",
Regret acum vocabularul,
Regret cuvintele ce vrură
Să dea OMEGĂi o măsură!

Epigramă de Florea Ştefănescu:
Despre X-i şi-a lor mulţime
Înţelepţii toţi au spus:
X-ii nu sunt la-nălţime
Însă îţi vorbesc de sus.
",1) Prostie 2) Prost,,,,Sergiu Rodideal,SV_2014,SER
11/6/2014 11:55:53,31,"ELE reprezintă mai mult de jumătate din gunoiul cules anual de pe vârful muntelui Ben Nevis, cel mai înalt din Marea Britanie. ELE apar deseori in filmele de comedie.

Numiți-le cu trei cuvinte.",Cojile de banană,,,,Marcel Spatari,C_T_2013_23_3_SL,Maktub
11/6/2014 11:56:34,7,"Dacă noi am fi avut runde formate din 8 întrebări, această întrebare ar fi, cel mai probabil, a 6-a. Timp de două secole, începînd cu secolul XV, el era considerat unica metodă de a scăpa de nebunia provocată de mușcătura unui păianjen, cum se credea în acele timpuri. Dacă vă dați seama care era denumirea păianjenului, nu vă va fi greu să răspundeți rapid, prin două cuvinte, ce este el.",Dansul Tarantella,,"Era considerat unica metodă de a scăpa de nebunia provocată de mușcătura tarantulei. Acest dans rapid are măsurile de 3/8, 6/8 sau 12/8. Și denumirea dansului, și cea a păianjenului, provin de la denumirea orașului italian sudic Taranto.",http://passionballet.topf.ru/viewtopic.php?id=105,Sergiu Iacob,SV_2014,SER
11/6/2014 11:57:07,32,"[foițe cu text]

Chief Houser to the Cabinet Office of the United Kingdom of Great Britain and Northern Ireland

Guvernul Marii Britanii are în jur de 100,000 de angajați cărora îi revine o anumită sarcină. Doi dintre aceştia locuiesc pe Downing Street 10 şi au titlul pe care-l vedeți pe foiță. Știind că în acest titlu am înlocuit o literă, spuneți-ne sarcina pe care o îndeplinesc aceștia.",Prind șoareci,,Titlul e Chief Mouser. Acestea sunt pisici.,http://en.wikipedia.org/wiki/Chief_Mouser_to_the_Cabinet_Office,Andrei Lutenco,C_T_2013_23_3_SL,LAREME
11/6/2014 11:57:18,8,"Savanţii ce au descoperit radiopulsarii, stele ce emit un semnal radio regulat, necunoscând  încă originea sursei de emisie, au denumit primul pulsar LGM-1, atribuind emisia LOR. Recent, apariţia LOR într-un stat est-european a avut urmări semnificative pe plan geopolitic. Numiţi-i pe EI descifrând acronimul englez LGM.",Little Green Men,,Savanţii au crezut că un asemenea semnal regulat ar putea fi emis de o formă inteligentî de viață. Așa au fost supranumiți soldații ruși din Crimeea.,,Maxim Cumpanici,SV_2014,SER
11/6/2014 11:58:19,9,"Blitz triplu:

1. Aşa a fost numit scandalul legat de presupusa încercare a lui Gigi Becali de a mitui fotbaliştii unei echipe adverse.

2. Gabriel Dorobanţu îşi îndemna iubita să vină în acest mic edificiu.

3. Otto von Bismarck spunea despre acest stat: ”Niciodată nu complotaţi împotriva lor – la oricare dintre vicleniele noastre ei vor găsi prostia sa”.
",1) Valiza 2) Gara 3) Rusia,,,,Maxim Cumpanici,SV_2014,SER
11/6/2014 11:58:38,33,"[foițe cu text]
 
The ignorant pronounce it _ _ ood,
To cavil or applaud.
The well-informed pronounce it _ _ oyd,
But I pronounce it _ _ aud.


Textul întrebării:

Ignoranții îl pronunță două litere omise ud
De-l critică sau îl laudă
Cei informați pronunță două litere omise oid
Dar eu îl pronunț două litere omise audă

Reproduceți cele 2 litere omise în poezia lui Chesterton adresate unei persoane.",Fr,,,https://www.goodreads.com/quotes/93590-the-ignorant-pronounce-it-frood-to-cavil-or-applaud-the,Sandu Cojocari,C_T_2013_23_3_SL,LAREME
11/6/2014 11:59:15,10,"[Înainte de întrebare, necesar de menționat că pauzele între runde vor fi cîte ___ minute]

Conform unui proverb japonez, pentru a se primi totul repede trebuie să acționăm încet, dar într-un anumit mod. Într-un minut scrieți prin 2 cuvinte în care mod trebuie să acționăm, ca încet să fie repede?",Fără întreruperi ,Fără pauze,,,Sergiu Rodideal,SV_2014,SER
11/6/2014 12:00:14,11,"La mijlocul anilor ‘1980, Peter O’Halloran a inventat un joc-concurs, care la început avea o importanță locală, iar mai tîrziu a ajuns să aibă o răspîndire globală. Cu o mare probabilitate, putem spune că și fiecare din voi a participat la acest joc, sau cel puțin a auzit de el.

Dacă vă dați seama care este naționalitatea creatorului acestuia, sau cel puțin ce profesie avea el, ne veți scrie peste un minut cum se numește acest joc.",Cangur,,"Peter O’Halloran era un profesor australian de matematică, care a propus ideea acestui joc-concurs, devenit foarte popular în lumea întreagă, odată cu trecerea timpului.",http://www.fisme.science.uu.nl/en/wiki/index.php/Kangaroo,Sergiu Iacob,SV_2014,SER
11/6/2014 12:00:42,34,"El și-a dedicat o parte importantă a carierei instruirii copiilor cu deficiențe de auz, iar o elevă a sa, Helen Keller, care nu putea să vadă, să audă sau să vorbească, a spus mai târziu despre EL că acesta şi-a dedicat viața misiunii de a penetra ""acea tăcere inumană care separă și înstrăinează."" 

Dar cu îi erau adresate cele mai celebre cuvinte pronunțate de el vreodată?",Lui Watson,Asistentului său. După nume (Watson) sau ocupația de asistent.,"E vorba de Alexander Graham Bell, inventatorul telefonului. Cele mai celebre cuvinte ale sale au fost şi primele pronunțate (și auzite) prin telefon ""Mr. Watson - Come here - I want to see you"".",http://en.wikipedia.org/wiki/Alexander_Graham_Bell,Andrei Lutenco,C_T_2013_23_3_SL,LAREME
11/6/2014 12:01:13,12,Un articol despre angajarea personalului şi resursele umane este numit XY la ZY. Ghiciţi cine a devenit popular în 2009 datorită ZY?,Guess Who,,Omul potrivit la locul potrivit.,http://ro.wikipedia.org/wiki/Locul_Potrivit,Maxim Cumpanici,SV_2014,SER
11/6/2014 12:01:42,35,"Flota maritimă a Nigeriei are patru nave de război: NNS Erinomi, NNS Enyimiri, NNS Dorina și NNS Otobo. Interesant este faptul că cele patru cuvinte: Erinomi, Enyimiri, Dorina și Otobo se traduc la fel. 

Răspundeți printr-un cuvânt din patru silabe, cum anume, dacă cele două silabe din mijlocul cuvântului sunt identice.",Hipopotam,,,,Marcel Spatari,C_T_2013_23_3_SL,Maktub
11/6/2014 12:02:03,13,"Din această listă fac parte, printre alții: Sir humphrey Davy, Marie Curie, Alexander Bogdanov, Horace Hunley, Otto Lilienthal și, la rubrica ”mituri populare”, Guillotaine. În listă este prezent și un român. Numiți-l.",Aurel Vlaicu,,,http://en.wikipedia.org/wiki/List_of_inventors_killed_by_their_own_inventions,Maxim Cumpanici,SV_2014,SER
11/6/2014 12:02:50,14,"Conform DEX on-line, X este definit ca o persoană cu rol conducător într-un domeniu de activitate; fruntaș, căpetenie. Despre Titu Maiorescu se spune că este X-ul ”Junimii”, iar în Grecia Antică, X- era conducătorul corului în tragedia și în comedia greacă antică.

Numiţi X.",Corifeu,,,,Maxim Cumpanici,SV_2014,SER
11/6/2014 12:03:01,37,"Într-un episod din Futurama, lui Fry îi apare un simptom după care doctorul Zoiberg îl diagnostichează cu icter al LOR. Al cui al LOR?",Simpsons sau Simpsoni,,Icter este denumirea literară a bolii cunoscute în popor drept gălbinări.,http://www.youtube.com/watch?v=6F35LMXQ-Dw,Ion Vasilică,C_T_2013_23_3_SL,LAREME
11/6/2014 12:04:14,38,"Personajul povestirii „Vulturul de cincisprezece dolari” de Sylvia Plath, spune că dacă se întâmplă să se despartă de iubita sa, își va cumpăra un ceas de mână.

Dar unde se află personajul în acel moment, dacă printre localurile de acest gen din Moscova se întâlnesc denumiri precum Stigma sau Status?",Salon de tatuaj,,Personajul dorea să-și tatueze numele iubitei pe antebraț. Denumirea povestirii de asemenea se referă la prețul unui tatuaj.,"Sylvia Plath ""Johny Panic și Biblia Viselor"", povestirea „Vulturul de cincisprezece dolari”",Andrei Lutenco,C_T_2013_23_3_SL,LAREME
11/6/2014 12:04:18,16,"Material distributiv:

MDA: MOF
ROM: SES
BLR: KASHEN
UKR: ???

Ce am ascuns prin semnele de întrebare?",Roshen,,Denumirea de ciocolata “Roshen” a fost formată prin eliminarea primei și ultimei silabe a numelui “Poroshenko”.,,Maxim Cumpanici,SV_2014,SER
11/6/2014 12:05:03,17,"Privind la rafturile cu  produse  alimentare originare dintr-o ţară vecină, autorul întrebării  a constatat că există riscul să facă strabism. Care două produse au nimerit în vizorul autorului întrebării?",Făină şi slănină	,,"Cu un ochi la făină, cu altul la slănină.",,Maxim Cumpanici,SV_2014,SER
11/6/2014 12:05:18,39,"În una din cercetările sale, psihologul Dan Ariely demonstrează că oamenii categorisesc experiențele ca fiind bune sau rele și nu în baza percepțiilor proprii, ci în dependență de comportamentul celor din jur. Astfel, ei pot fi ușor manipulați.

Numiți locuitorul Saint Petersburgului, numele căruia apare în denumirea cercetării.",Tom Sawyer,,"Sawyer era pedepsit și trebuia să vopsească gardul. Dar pretinzând că experiența este una pozitivă, i-a manipulat pe băieții din „mahala” să îi plătească pentru ca să poate şi ei lucra.","Tom Sawyer and the construction of value, Dan Ariely, George Loewenstein, Drazen Prelec",Rita Kotenko,C_T_2013_23_3_SL,Maktub
11/6/2014 12:06:01,18,"Pe 6 iulie 2012, curierul pe bicicletă ucrainean Vitalii Arhipkin a stabilt un nou record în sur place – o tehnică ce constă în păstrarea echilibrului pe bicicletă, cu deplasare minimă înainte sau înapoi fără a atinge pămîntul, acest nou record constituind 5 ore, 29 de minute și 12 secunde. Conform spuselor recordmanului, un mare merit în succesul său l-a avut anume ea, deoarece l-a asigurat cu practica necesară. În mod sigur, ea v-a stat în cale și vouă de nenumărate ori.

Scrieți prin patru cuvinte ce este ea.",Culoarea roșie a semaforului,,"Fiind curier, Vitalii Arhipkin era nevoit să petreacă mult timp așteptînd culoarea verde la intersecții, timp în care el practica sur place-ul.",https://www.youtube.com/watch?v=IpZJWvkdXtI,Sergiu Iacob,SV_2014,SER
11/6/2014 12:06:31,19,"Întrebare simplă. Proverb  japonez. La 10 ani – minune. La 20 ani – geniu. Răspundeți prin două cuvinte ce devine omul după 30 ani, conform acestui proverb?",Om simplu,,,,Sergiu Rodideal,SV_2014,SER
11/6/2014 12:06:57,40,"Inspirația și talentul său parcă veneau din aer. De mic copil era pasionat de muzică, iar în anii 20 a inventat un sistem de alarmă anti-jaf. Numiți-l.",Leon Theremin,"Lev Termen, Ле́в Терме́н și orice variantă a numelui de familie. Se acceptă și ""inventatorul termenvoxului"".",Inventatorul termenvoxului (cunoscut și ca theremin) - primului instrument muzical electronic la care execuția se face prin mișcarea mâinii în apropierea unei antene.,http://en.wikipedia.org/wiki/L%C3%A9on_Theremin,Andrei Lutenco,C_T_2013_23_3_SL,LAREME
11/6/2014 12:07:23,20,"Blitz dublu.

Geneticienii nu sunt lipsiți de simțul umorului. Astfel, biologii care studiază drozofilele, obișnuiesc să dea nume genelor mutante pe care le descoperă în așa un mod, încît aceste denumiri să reflecte funcția genei descoperite, dar și să fie asociate culturii populare. Spre exemplu, gena mutantă, posesorul căreia decedează în decurs de două zile de la infectarea cu un tip de bacterie, este numită  ”Kenny”, în cinstea personajului din ”South Park”.

1. Gena, mutația în care duce la moartea drozofilelor, din cauza că la acestea nu se dezvoltă inima, este numită în cinstea unui personaj. Care anume?

2. Perechea de gene, defectul în care duce la lipsa completă a organelor genitale externe este numită în cinstea lor. Numiți-i.

",1) Omul de Tinichea 2) Ken și Barbie,,,http://www.nkj.ru/archive/articles/24070/,Sergiu Iacob,SV_2014,SER
11/6/2014 12:07:48,41,"Dacă schimbăm o literă și omitem o altă literă într-un cuvânt compus, obținem denumirea unui restaurant de bucătărie asiatică, care sugerează că meniul său este mixt, combinând mai multe stiluri culinare. Iar dacă e să analizăm în parte elementele denumirii, atunci primul este un instrument în care e pregătită mâncarea servită, iar ultimul – un proces și un produs ce poate fi găsit aici.

Reproduceți denumirea restaurantului.",Wok-and-Roll,,,De la fața locului.,Rita Kotenko,C_T_2013_23_3_SL,Maktub
11/6/2014 12:08:04,21,"Vă rugăm să păstraţi liniştea.
Papa Sixt al V-lea a ordonat ca acest lucru să i se facă autorului unei glume, ce făcea aluzie la coruptibilitatea sa. Recent, enoriaşii prea zeloşi ai unei biserici din Rusia au facut același lucru cu clopotul bisericii. Ce anume?
",I-au smuls limba,,,http://progorod11.ru/newsv2/20612.html,Maxim Cumpanici,SV_2014,SER
11/6/2014 12:08:41,42,"Statul brazilian Rio Grande do Sul are doar 5% din populația țării, dar de acolo provin 70% din cafelele braziliene. Fotbalistul Ronaldo era recunoscut pentru faptul că iubea cafelele braziliene.

Care trei litere au fost înlocuite în textul întrebării?",mod,,Cafelele - Modelele,,Marcel Spatari,C_T_2013_23_3_SL,Maktub
11/6/2014 12:08:44,22,"Lovirea unei bucăți de carne crudă cu un ciocan de lemn; lovirea unei pelicule întinse cu o bucată de elastic; ruperea țelinei; comprimarea unui pachet plin cu amidon sau lovirea într-o careva suprafață cu jumătăți de nucă de cocos. Oricat ar părea de straniu, toate acestea sunt făcute în timpul executării unei anumite acțiuni.

Atunci cînd veți da răspunsurile, nu va fi deloc necesar ca voi să o faceți. Peste un minut, numiți această acțiune printr-un substantiv.",Sonorizare,,"Toate acestea se folosesc în cinematografie pentru a înlocui anumite sunete (respectiv, sunete de bătaie, împușcătură, ruptură de os, scîrțîitul zăpezii sau fuga calului).",https://ru.wikipedia.org/wiki/%D0%A8%D1%83%D0%BC%D0%BE%D0%B2%D0%B8%D0%BA,Sergiu Iacob,SV_2014,SER
11/6/2014 12:09:48,23,"În anul 1942 el a fost înrolat în armată. Cu toate că inițial slujea în Mongolia, unde avea grijă de caii pregătiți pentru front, el era gata să slujească oriunde: în artilerie, în cavalerie, în flotă, în cercetare – o listă întreagă. Peste mai mulți ani, schimbîndu-și domeniul de activitate, el a adaptat această dorință a sa de a face orice și a imortalizat-o.

Cine este el?",Leonid Gaidai,,"Acest episod de pe timpul cînd era în armată, regizorul l-a imortalizat în comedia ”Операция «Ы»”, în care personajul era gata să facă orice lucru, doar ca să scape de studentul ce îl tachina. ”O listă întreagă” este o aluzie la ”Огласите весь список, пожалуйста!”, din același film.",http://www.pravda.ru/news/society/fashion/30-01-2008/253697-0/,Sergiu Iacob,SV_2014,SER
11/6/2014 12:10:24,24,"Născut in 1899 la Londra, la vârsta de 7 ani ACESTA a fost înscris la colegiul iezuit St. Ignatius, unde domnea un regim foarte sever. Pentru neascultare sau alte mici greșeli, băieții erau bătuți cu o vergea groasă de gumă. Dar locul și timpul când urma să fie aplicată pedeapsa erau alese chiar de cel pedepsit și această amânare a unei pedepse iminente îl teroriza pe copil câteva zile.

Se consideră că această așteptare terifiantă a pedepsei a influenţat creaţia sa ulterioară. Numiţi-l.",Alfred Hitchcok,,,,Maxim Cumpanici,SV_2014,SER
11/6/2014 12:11:23,25,"Recent, Almir Badykov, un candidat la funcția de deputat în consiliul orășenesc al unui mic oraș dintr-o republică a Federației Ruse, s-a plîns că multă lume nu l-a votat, doar pentru faptul că este un RATAT. Pe Traian Băsescu, originar din Murfatlar, adversarii politici îl poreclesc cîteodată ”RATATUL”. Unii cercetători afirmă că și Dimitrie Cantemir avea strămoși RATAȚI.

Ce a fost înlocuit prin ”RATAT”?",Tatar,,,"http://www.ansar.ru/society/2011/04/22/14568
http://www.gandul.info/politica/severin-il-cauta-din-nou-pe-basescu-la-origini-urmasul-lui-ginghis-han-3870569
http://www.azi.md/ro/print-story/6477
",Maxim Cumpanici,SV_2014,SER
11/6/2014 12:12:12,26,"În natură există organisme ce se dezvoltă din fuziunea a două ovule, fecundate de spermatozoizi diferiti si care au, în rezultat, seturi de ADN ce diferă în cadrul aceluiați organism, în dependență de țesut. Astfel de organisme, după analogie, și-au primit numele în cinstea ”caprei tinere„ antice. Cum sunt numite acestea?",Himere,,"S-a făcut analogie cu himera mitologică, care era un monstru format din mai multe părți de la diferite animale. Mot-a-mot, cuvîntul ”himeră” se traduce drept ”capră tînără”.","https://ru.wikipedia.org/wiki/%D0%A5%D0%B8%D0%BC%D0%B5%D1%80%D0%B0
http://dexonline.ro/definitie/himer%C4%83
",Sergiu Iacob,SV_2014,SER
11/6/2014 12:12:16,43,"Într-un grafic al producției României pentru o anumită ramură industrială, o anumită sursă de producție, care generează 40% din total, era prezentată în culoarea verde, o alegere reușită și sugestivă. Autorul întrebării consideră că utilizarea culorii albastre ar fi fost prea banală. 

Răspundeți cu exactitate: ce fel de producție era prezentată în graficul respectiv în culoarea verde?",Hidroelectricitatea,Electricitatea produsă de hidrocentrale,,,Marcel Spatari,C_T_2013_23_3_SL,Maktub
11/6/2014 12:13:12,28,"Acest dispozitiv a fost creat la iniţiativa omului de afaceri Seymour Durst în 1989, ce dorea sa atragă atenţia societăţii americane asupra unei anumite probleme. Problema dată s-a extins destul de rapid, astfel încît deja în octombrie 2008  volumul problemei a depăşit capacitatea de  indicare a dispozitivului.

Dar ce indică acesta?",Volumul datoriei externe a SUA,,,http://en.wikipedia.org/wiki/National_Debt_Clock,Maxim Cumpanici,SV_2014,SER
11/6/2014 12:14:09,29,"La repetiția ceremoniei de închidere a Olimpiadei din Moscova un grup mare de organizatori țineau în mîini panouri colorate, care în ansamblul lor formau imaginea talismanului competiției – Mișka. O persoană din acest grup, din greșeală, a întors panoul pe care îl ținea în miîni cu partea dorsală în sus. Cînd regizorul a observat aceasta și a ordonat ca panoul sa fie întors invers, toți organizatorii unui rînd, neînțelegîndu-l corect, au început să-i execute porunca. Astfel, în varianta finală a ceremoniei, a apărut ea și a intrat în istorie ca unul din cele mai emoționante momente ale Olimpiadei. Ce este ea?",Lacrima,,Valul de panouri întoarse care s-a stîrnit după ordinul regizorului a adus aminte tuturor de o lacrimă ce curge din ochiul lui Mișka.,"Первый канал, программа «Олимпиада-80. 30 лет спустя», 18.07.2010",Sergiu Iacob,SV_2014,SER
11/6/2014 12:15:10,44,"[foițe cu text]
1. Stuck here out of gas
    Out here on the ___ ____

2. Let's ride the ___ down river ____

3. ____ make it float
   One sip from the salty wine


Bliț triplu despre Orientul Mijlociu:

1. ""Blocat aici fără combustibil
     Aici în (două cuvinte omise)""

Completați versul din Cântecul formației Pixies cu un toponim în română sau engleză.

2. ""Hai să mergem călare pe (cuvânt omis) de-a lungul râului (cuvânt omis)""

Restabiliți oricare din cele două toponime omise din cântecul formației Pixies.

3. ""(două cuvinte omise) o face să plutească. O sorbitură de vin sărat.""

Completați versul din Cântecul formației Pixies cu un toponim.","1. Fâşia gaza sau Gaza Strip, 2. Tigru sau Eufrat,  3. Marea Moartă sau Death Sea",,,"Pixies ""River Euphrates""",Andrei Lutenco,C_T_2013_23_3_SL,LAREME
11/6/2014 12:15:37,30,"Blitz dublu anticipat:

1. În întrebare sunt înlocuiri. În timpul filmării acestei pelicule, regizorul a decis că toți actorii care îi joacă pe ei trebuie să aibă accent irlandez, deoarece presupunea că limba lor suna tot așa pentru greci, cum sună irlandeza pentru un american. Dacă v-ați dat seama cine sunt ei, scrieți despre ce film e vorba.

2. Acest prieten apropiat l-a însoțit pe Franklin Delano Roosevelt din 1940 pînă la moartea acestuia. Statuia lui însoțește monumentul președintelui, aflat în memorialul din Washington, și el este unicul de felul său care s-a dovedit a fi demn de o asemenea onoare. Care este numele său?
",1) Alexander 2) Fala,,"1) Oliver Stone credea că grecii antici auzeau limba macedoneană aproximativ așa cum aude un american irlandeza. 2) Fala este numele cîinelui lui F.D.Roosevelt, și el este unicul animal de companie prezidențial care este imortalizat în acest fel.
Prin această întrebare, îl felicităm un pic anticipat pe Alexandru Fala cu jubileul de 30 de ani.","http://www.alexanderthemovie.ru/text/article/now.htm
http://en.wikipedia.org/wiki/Fala_%28dog%29
",Sergiu Iacob,SV_2014,SER
11/6/2014 12:16:22,31,"Acest obiect a fost construit în anul 1908 în Shelburne Falls, Massachusets. Ulterior, din cauza reducerii importanţei acestuia pentru transport, Clubul Femeilor din localitate, care  îngrijeşte obiectul  şi astăzi, a operat careva modificări asupra sa, datorită cărora acesta şi-a căpătat numele. Românii au  realizat o construcţie similară la începutul anilor ‘90.

Cum se numeşte acest obiect?",Podul de flori,,,http://en.wikipedia.org/wiki/Bridge_of_Flowers_%28bridge%29,Maxim Cumpanici,SV_2014,SER
11/6/2014 12:16:23,45,"Robert Capa, care a fost și în Spania anilor '30 și în Normandia anului 1944 și Indochina anilor '50, spunea: 

""Războiul e ca o femeie bătrână. Cu timpul devine tot mai puțin ..."". 

Completați citatul.",Fotogenică,,Capa e un fotograf celebru.,,Ion Vasilică,C_T_2013_23_3_SL,LAREME
11/6/2014 12:17:04,32,"O ghicitoare indiană, ceva mai tare. În ziua în care se naște, ea este albă, în ziua următoare îmbracă haine verzi, în cea de-a treia zi – roșii; apoi ea își aruncă hainele și pleacă peste hotare. Ce este ea?",Nuca,,,http://gamevil.ru/index.php/zagadki-mira/816-zagadki-mira,Sergiu Iacob,SV_2014,SER
11/6/2014 12:17:25,33,"X este și denumirea unui tip de mîncare, preparată de obicei din legume sau din fructe, dar şi a unui important port de pe ţărmul Mării Egee. Numiţi X.",Pireu,,,,Maxim Cumpanici,SV_2014,SER
11/6/2014 12:18:20,34,"Inițial, ea lipsea definitiv. Mai tîrziu, cînd numărul cărților a crescut puțin, din motive de comoditate ea a apărut și avea o anumită direcție, care predomină și astăzi în SUA și în Europa de Vest. Ulterior, cînd numărul cărților a crescut și mai mult, direcția ei s-a schimbat, iarăși din motive de comoditate, astăzi ea predominînd în Europa de Est. Ce este ea?",Inscripția de pe cotorul cărții,,"Inițial de ea nu era nevoie, pentru că fiecare avea foarte puține cărți. Cînd numărul acestora a crescut, a apărut inscripția de pe cotor, care avea direcția de sus în jos, pentru ca aceasta să poată fi citită atunci cînd cartea stă pe masă în poziție orizontală sau înt-un clid de cărți. Apoi inscripția de pe cotor a început să fie scrisă de jos în sus, pentru ca ea să poată fi citită comod atunci cînd cartea stă pe poliță în poziție verticală.",http://www.artlebedev.ru/kovodstvo/sections/122/,Sergiu Iacob,SV_2014,SER
11/6/2014 12:18:51,36,"Banc. Familiile indiene sunt cele mai trainice, pentru că mirele în ziua nunții primește în dar o armă de foc. Dar ce i se face miresei?",I se deseneaza un punct roșu pe frunte ,,,,Maxim Cumpanici,SV_2014,SER
11/6/2014 12:19:43,37,"Vera Renczi, născută în 1903 la Bucureşti, este  cunoscută pentru faptul că vrând sa fie cea din urmă, a săvârşit o anumită acţiune de 35 de ori. Pentru aceasta, a fost supranumită ca şi o vietate cu un comportament asemănător.

Cum o fost supranumită Vera Renczi?",Văduva Neagră,,"Cunoscut criminal în serie, Vera Renczi a otrăvit 35 de amanţi ai săi.",,Maxim Cumpanici,SV_2014,SER
